"3. ענין הסכך המכונה צל נעשה דווקא מפסולת גורן ויקב. וזה ענין מה שאנו אומרים בתפילה שבתוך הסוכה, ""ולחסות מזרם וממטר"", היינו שהאמונה מציל את האדם מכל המזיקים. כי ענין מזיקים הוא ענין מחשבות זרות ודיעות זרות, והאמונה נבנית דווקא על פסולת, ורק באופן כזה הוא החסיה מזרם וממטר, אחרת האדם נמשך עם זרם העולם. "
"(הרב""ש. אגרת ל""ו)"

"4. ענין מטר הוא דבר המחיה את האדמה, כי אנשים שהם מבחינת הדומם הם אינם ניזונים, אלא מבחינת הדעת, ורק הדעת יחיה אותם. ובמקום שאין הדעת מגיע, הם אינם מסוגלים להחזיק מעמד. והדעת הזה משאיר אלה אנשים בבחינת הדומם. "
"מה שאין כן מי שרוצה להיות בבחינת צומח, אסור לו לקבל את הדעת הזה לסמיכה. כי המטר הזה אינו מסוגלת למי שרוצה ללכת בדרך האמת. ואם האדם נכשל, ולוקח לעצמו איזה סמיכה מהדעת הזה, תיכף הוא מקבל ירידה ונפילה לשאול תחתיות. "
"מה שאין כן לבחינת הדומם יש בידו לקיימם, ולא מקבלים שום נפילות, לכן הם מחפשים תמיד בחינת דעת שיסמוך את עבודתם. ובכדי לא להכשל בהדעת הזה הנקרא מטר יש סגולה בהסכך, וזה שאנו אומרים ""ולחסות מזרם וממטר"". "
"(הרב""ש. אגרת ל""ו)"

"5. סוכה היינו סכך, שהיא ""פסולת גורן ויקב"". וסכך נקרא צל. וצל נקרא הסתרת פנים. ובכדי שלא יהיה נהמא דכסופא יש לנו מקום עבודה, היינו שיכולים לעסוק בתורה ומצוות אע""פ שלא מרגישים שום טעם וחיות - וממילא אנחנו יכולים לקבל אח""כ את החיות ולא לפגום במתנה, היינו שהמתנה לא תהיה נפגמת מחמת הבושה הנוהגת במקבל."
"(הרב""ש. אגרת י""ב/ב')"

"6. סוכה הוא בחינת צילא דמהימנותא [צל האמונה], ומצד הדין צריך ""צלתה מרובה מחמתה"". וזה ידוע, שחמה מרומז לבחינת ידיעה, ולבנה מרומזת לבחינת אמונה. והוא על דרך שאמרו חז""ל, ""ישראל מונין ללבנה, ואומות העולם מונין לחמה"". היינו, שבכל פעם שרואין שיש בחינת חמה, ושהוא מרובה מצילתה, אזי צריכים לכסות יותר, בכדי שצלתה יהיה יותר מרובה. "
"(הרב""ש. אגרת ל""ו)"

"7. אם האדם בעל זוכה, ואין הוא מוסיף מעצמו בחינת צל, אז מהשמים מרחמים עליו ומכסים את החמה עבורו. ואז האדם נעשה ברוגז, היות שהאדם מבין אחרת. האדם לפי שכלו, אם יש לו בחינת חמה אזי רוצה שיוסיפו לו בחינת חמה, אבל ""לא מחשבותי מחשבותיכם"", ומוסיפים לו בחינת צל. "
"ואם האדם מתגבר על הצל נותנים לו בחינת חמה. ואז האדם צריך להוסיף בחינת צל. ואם אינו מוסיף, אזי מוסיפים לו בחינת צל מהשמים, וחוזר חלילה. עד שזוכה לדביקות לנצחיות. "
"(הרב""ש. אגרת ל""ו)"

"8. צריכים להתאמץ בהתאמצות יתירה לקבל את הצל, ולאמור שזה צל קדוש, שכל הצל הזה בא משמים ולא מהסטרא אחרא, שנתנו לו זה בכדי שיהיה לו מקום לקבל על עצמו את האמונה, ואז זה נקרא צילא דמהמנותא [צל האמונה], וזה קדוש. ועל דרך ""כי ישרים דרכי ה', צדיקים ילכו בה ופושעים יכשלו בה""."
"(הרב""ש. אגרת ל""ו)"

"9. סוכות הוא בחינת שמחה, שהוא בחינת גבורות המשמחות, שהוא סוד תשובה מאהבה, שזדונות נעשו לו כזכיות. "
"(בעל הסולם. ""שמעתי"". צ""ז. ""ענין פסולת גורן ויקב"")"

"10. הסוכה נעשית מד' דפנות וסכך. אבל המקום של הסוכה הוא מהמוכן שהאדם יכול לעשות סוכתו על הקרקע שהוא בחינת החומר ועל החומר הזה עושים צורה, היינו צורת סוכה. ויש להבין ענין דפנות וענין הסכך שהוא פסולת גורן ויקב. ידוע הכלל שיש ד' צדדים ומעלה ומטה, הנקרא חג""ת ומלכות ונצח למעלה והוד למטה. "
"[...] למטה הוא בחינת הקרקע, שהוא האדם, שאם עושה סוכה כשירה הוא בחינת ""הוד"" הנקרא ""נוי סוכה"" ואם לאו חס ושלום ה""הוד"" הפך ""לדוה"". "
"היינו, על מקום הארץ לא צריכים שום דבר לרמז, אלא מה שהוא ממשיך ומכוון בכל החמשה בחינות, כך באותו הצורה מתראה בארץ שהוא בחינת האדם הנמשך משורש המלכות, הנקרא לית לה מגרמה ולא מידי, היינו מבחינתה עצמה אין לה שום דבר אלא מה שיהבין לה, היינו זה תלוי בצורת הסוכה. "
"(הרב""ש. 892. ""מאמר לסוכות"")"

"11. סוכות הוא דירת עראי. היינו, מי שכבר זכה לדירת קבע, וכבר אין לו מה לעשות, אז העצה שיצא לדירת עראי. כמו שהיה בזמן, שהלך בדרך להגיע לבית ה', מטרם שהגיע לדירת קבע. שאז היה לו כל פעם צורך להגיע להיכל ה'. והיה לו אושפיזין, היינו בזמן שעבודתו היתה בבחינת אורח עובר. ועתה הוא יכול להמשיך מזמן עבודה שעבר, שהיה אז תמיד מודה ומשבח את ה', בזה שהקב""ה היה מקרבו בכל פעם, ומזה היה לו שמחה. השמחה שהיה לו אז, הוא יכול להמשיך עכשיו, בסוכות. וזהו רמז של דירת עראי. לכן אמרו: ""צא מדירת קבע ושב בדירת עראי"". "
"(בעל הסולם. ""שמעתי"". צ""ו. ""מהו פסולת גורן ויקב, בעבודה"")"

"12. המצוה, ""צא מדירת קבע ושב בדירת ארעי"". כלומר, כי תדע, כי רק דירת ארעי הוא, וח""ו לא ידח ממנו נדח. עד""ש ז""ל: ""אפילו כל העולם כולו אומרים לך צדיק אתה, היה בעינך כרשע"", וז""ס הכתוב ""והיית אך שמח"". ועל כן נקרא חג האסיף זמן שמחתנו, ללמדך שהאדם צריך לשבת בצל סוכה בשמחה גדולה, בשוה ממש כמו בבית המלך, ויושבים ראשונה במלכות, ""תשבו"" כעין ""תדורו"", בלי שום הבדל כלל וכלל. ועם כל זה ידע שיושב בצל סוכה, דהיינו, פסולת גורן ויקב, אלא ש""בצלו חמדתי וישבתי"", להיותו שומע דברו ""צא מדירת קבע ושב בדירת ארעי"". ואלו ואלו דברי אלקים חיים. ואז יציאתו הנאה לו כביאתו. "
"(בעל הסולם. אגרת נ""א)"

"13. ענין המצוה ""תשבו"", כמו תדורו, פירוש, ע""ד שדוד המלך ביקש ""שבתי בבית ה' כל ימי חיי לחזות בנועם ה'"". כי ""בית ה'"", זו השכינה הקדושה כנודע [...] וכשזוכים ביותר, אז תהיה לו כמו בית, בקביעות לנצחיות. והיה ברצון השי""ת לומר לעבדיו, ""צא מדירת קבע ושב בדירת ארעי"", דהיינו, רק בצלו ית' לבד, שה""ס מצוה קלה, מצות סוכה, שהאדם יושב בצל פסולת גורן ויקב, שהוא ממש צל השי""ת, ואע""ג שהם תרתי דסתרי, שהרי בעינים הגשמיים ובידים הגשמיים, אנו רואים וממשמשים שהצל מכח פסולת בא. ובאמת הוא השי""ת בכבודו ובעצמו, אלא מצד המקבל בהכרח שיתרשמו בו ב' הצורות ההפכיות הללו. "
"(בעל הסולם. אגרת נ""א)"

"14. פרי עץ הדר. ארבעה מינים הללו, יש מהם שיש בו טעם וריח, כמו האתרוג, והוא כנגד הצדיקים, שיש בהם רוח תורה וטעם של מעשים טובים. "
"באילן שבו גדל הלולב יש בו טעם ולא ריח, וכנגדו הבינונים של ישראל, שיש בהם טעם של מצוות ואין בהם רוח תורה. ההדס יש בו ריח ולא טעם, והוא כנגד אותן, שיש בהם רוח תורה ואין בהם מצוות. וערבה אין בה לא טעם ולא ריח, וכנגדן עמי הארץ, שאין בהם לא רוח תורה, ולא טעם של מצוות. "
"ואנו אוגדין הארבעה ביחד, רמז שאין הקדוש ברוך הוא מתרצה לישראל עד שיהיה כולן לאגודה אחת. "
"(הרב""ש. 893. ""פרי עץ הדר"")"

"15. כתוב ""ולקחתם לכם ביום הראשון, פרי עץ הדר, כפות תמרים, וענף עץ עבות, וערבי נחל"". ויש לפרש: ענין ""כפות"" פירושו כפיה, שהאדם מקבל מלכות שמים על דרך הכפיה, כלומר אפילו שהדעת אינו מסכים. והוא הולך למעלה מהדעת, וזה נקרא ""זווגין על דרך הכפיה""."
"""תמרים"" מלשון מורא, שהיא בחינת יראה (שזהו בחינת ""אלקים עשה שיראו מלפניו"")."
"ומשום זה נקרא ""לולב"", כלומר, שמטרם שאדם זוכה יש לו ב' לבות. וזה נקרא ""לא לב"", היינו שהלב שלו לא היה מיוחד לה'. וכשזוכה לבחינת לו, שפירושו ""לה' לב"", וזהו ""לולב""."
"וכמו כן צריך האדם לומר: ""מתי יגיע מעשי למעשי אבותי"", שעל ידי זה זוכים להיות בחינת ""ענף לאבות הקדושים"", שזה סוד ""וענף עץ עבות"", שהם ג' הדסים."
"ויחד עם זה צריך להיות גם בחינת ""ערבי נחל"", שאין להם טעם וריח. וצריך להיות בשמחה מעבודה זו, אע""פ שאין לו טעם וריח בעבודה זו. ואז נקרא עבודה זו בשם ""אותיות שמך המיוחד"", שעל ידי זה זוכים ליחוד ה' בכל השלמות. "
"(בעל הסולם. ""שמעתי"". פ""ה. ""מהו, פרי עץ הדר, בעבודה"")"

"16. אנו רואים באתרוג, שההידור נמצא בו דוקא טרם שראוי לאכילה. מה שאין כן בזמן שהוא ראוי לאכילה, כבר אין בו הידור וזה בא לרמז לנו על ענין עבודה ד""ראשון לחשבון עונות"". כלומר, שדוקא בזמן עבודה דבחינת ""ולקחתם לכם"", היינו העבודה בזמן קבלת עול מלכות שמים, שהגוף מתנגד אז לעבודה זו, אז יש מקום לשמחה של הידור. היינו, שבזמן עבודה זו ניכר ההידור. כלומר, אם יש לו שמחה מעבודה זו, זהו מטעם, שהעבודה זו הוא אצלו בבחינת הידור ולא בזיון. "
"(בעל הסולם. ""שמעתי"". י""ט. ""מהו, שהקב""ה שונא את הגופים, בעבודה"")"

"17. ערבות שבלולב, רומזות שהעבודה צריכה להיות אפילו בבחינת ערבות. אף על פי שבערבות אין בהם טעם וריח, כמו שאמר אאמו""ר זצ""ל על מה שכתוב (בהושענות), ""בערבי נחל לשעשעך"". היינו שאפילו שהוא אינו מרגיש טעם בעבודה, אלא שהם כערבי נחל, שאין בהם טעם וריח, יהיו אצל האדם בעת העבודה, כמו שעשועים גדולים. וזה נקרא, כניעה ללא תנאי. וזהו מה שכתוב, ""ועלזו לפניו"", היינו שיהיו בשמחה כמו שיש להם השגות הגדולות. וזהו שעשועים לפני ה', וכך להאמין. "
"(הרב""ש. מאמר 22 ""מהי שושנה בין החוחים, בעבודה"" 1991) "

"18. ענין ""אושפיזין"" אאמו""ר זצ""ל פירש, שזהו ענין המובא בזהר הקדוש, אורחא למעברי ביה, שאור החכמה אינו יכול להאיר בקביעות."
"וזהו ענין ""מזל"", שבני חיי מזוני - במזלא תליא מילתא, כמובא בתלמוד עשר הספירות (חלק י""ג), שהוא מלשון ""יזל מים מדליו"", שענין נוזל, שהוא רק בבחינת טיפין טיפין, היינו שאינו מאיר, אלא בהפסקות. מה שאין כן קילוח זה שמאיר בלי הפסק."
"לכן האורחין אוהבים שיהיה לו מקום רחב. מה שאין כן כשהם באים והמקום הוא צר, אין הם יכולים להכנס."
"והכוונה היא, שאור החכמה אינו יכול להאיר, אלא בהתלבשות החסדים. וחסדים נקרא רחב, כמבואר בתלמוד עשר הספירות. ואור החכמה נקרא בחינת אושפיזין, כנ""ל. לכן, אם אין לו חסדים, אין הוא יכול להתלבש."
"(הרב""ש. 624. ""ענין אושפיזין"")"

"19. כל אלו ד' המינים הם האורחים, שבע ספירות חג""ת נהי""מ, שהעם הקדוש הזמינו אותם ביום הזה, על דרך שמתפללים בימי הסוכות קודם הסעודה, ואומרים, עוּלוּ אוּשְפּיזין עילאין, בואו אורחים עליונים. שצריכים למצוא אותם, מאחר שהזמין אותם, ובהם מתפלל האדם תפילתו אל המלך. וע""י ד' המינים, שרומזים לאלו הספירות, הוא משיג אותם."
"(""זוהר לעם"". ויחי. מאמר ""ד' מינים"", סעיף 227)"

"1. הנה ידוע ש""מלא כל הארץ כבודו"", וכך צריך כל אדם להאמין, כמו שכתוב: ""את השמים ואת הארץ אני מלא"". אלא שהקב""ה עשה את ההסתרה שלא יכולים לראות את זה מטעם כדי שיהיה מקום בחירה, ואז יש מקום אמונה - להאמין שהקב""ה ""ממלא כל עלמין וסובב כל עלמין"". ולאחר שהאדם עוסק בתורה ומצוות ומקיים את מצות הבחירה, אז מגלה הקב""ה את עצמו לאדם ואז רואה שהקב""ה הוא השולט על העולם. "
"נמצא, שאז עושה האדם את המלך שישלוט עליו, זאת אומרת שהאדם מרגיש את הקב""ה שהוא השולט על כל העולם, וזה נקרא שהאדם עושה את ה' למלך עליו. כי כל זמן שהאדם לא בא לידי הרגשה כזאת, נמצא שמלכותו של ה' היא בהסתרה. וזה שאנו אומרים: ""ביום ההוא יהיה ה' אחד ושמו אחד"", היינו שיתגלה כבוד מלכותו עלינו. "
"וזה כל התיקון שמוטל עלינו לעשות בעולם הזה, ועל ידי זה ממשיכים כל טוב בעולם, שכל ההשפעות שלמעלה נמשכות בזה שעוסקין בתורה ומצוות בכוונה להמשיך מלכותו יתברך עלינו. "
"(הרב""ש. אגרת ע""ו)"

"2. ""אבינו מלכנו, אין לנו מלך אלא אתה"". היינו, שרק הבורא יכול לעזור, שיהיה לנו המלך, שנוכל לעבוד מטעם, שהוא משמש את המלך. וזה הוא השכר שלו. שיש לו זכיה, שהוא משמש המלך. זאת אומרת, שרק אז יש בידו לעשות הכל לשם שמים."
"כלומר, שאם אין הבורא נותן לו את הכח הזה, שירגיש, שיש לנו מלך גדול, אין כח בידו לעשות לשם שמים. כי הגוף טוען ""מה יהיה לך, מזה שאתה תשפיע לה'"". היינו, שכל זמן שהרצון לקבל שולט, אין לאדם שום עצה, כנ""ל. שיש לפעמים, שהוא תוהה על הראשונות. היינו שאומר, שעכשיו הוא רואה, שעבד בחינם, ולא הרויח כלום, מזה שנתן יגיעה. ועתה הוא רואה ממש, שכל יגיעתו היתה לריק."
"לכן כשהבורא עוזר לו, ונותן לו את הרצון להשפיע, והוא מרגיש, שיש לו מלך גדול, זה רק הבורא יכול לתת, כנ""ל. וזה שכתוב ""אבינו מלכנו, אין לנו מלך אלא אתה"". שרק אתה יכול לתת לנו, שנרגיש, שיש לנו מלך גדול, וכדאי לעבוד בשבילו, לעשות לו נחת רוח. "
"(הרב""ש. מאמר 1 ""מהו, אין לנו מלך אלא אתה, בעבודה"" 1991)"

"3. אינו דומה היושב בביתו, כאילו עומד בפני מלך. זאת אומרת, שהאמונה צריך להיות, שירגיש כל היום, שהוא עומד בפני המלך. שאז בודאי יש לו אהבה ויראה בשלימות. וכל זמן שלא הגיע לבחינת אמונה כזו, לא צריך לנוח ולשקוט, מטעם ""כי זה חיינו ואורך ימינו"", ושום פיצוים שבעולם לא ירצה לקבל. והחסרון אמונה צריך שיהא נקלע באברו, עד שהרגל נעשה טבע שני, בשיעור ""בזוכרי בו איננו מניח לי לישון"". "
"(בעל הסולם. ""שמעתי"". רי""א. ""כעומד בפני מלך"")"

"4. יש לפעמים, שהמלך הוא כל כך חשוב אצל האדם, והאדם משתוקק רק לדבר עם המלך. ולא מטעם, שרוצה לדבר עם המלך, בכדי שהמלך יתן לו משהו, הוא לא רוצה שום דבר, אלא כל ההנאה שלו, היא בזה שיש זכיה לדבר עם המלך. אלא שאינו מדרך הנימוס, לכנס להמלך ושלא לבקש איזו בקשה. "
"ואי לזאת, הוא מחפש איזו בקשה, שהמלך ימלא לו את בקשתו. היינו, שהוא אומר, שהוא רוצה לכנס להמלך, בשביל איזה דבר, שהמלך יתן לו. אבל לאמיתו של דבר, זה שאומר, שהוא רוצה, שהמלך יתן לו משהו, זה רק משפה ולחוץ. אבל באמיתות הלב הוא לא רוצה שום דבר מהמלך. אלא זה שיש לו היכולת לדבר עם המלך, זה מספיק לו, ולא חשוב לו, אם המלך נתן לו משהו, או שלא נתן לו שום דבר."
"(הרב""ש. מאמר 9 ""גדלות האדם תלויה בשיעור אמונתו בעתיד"" 1987)"

"5. עיקר מה שחסר לנו, שמסיבה זאת אין לנו חמרי דלק לעבודה, הוא שחסר לנו חשיבות המטרה, שפירושו שאין אנו יודעים איך להעריך את השרות שלנו, שנדע למי אנו משפיעים. וכן חסר לנו את הידיעה של גדלות ה', שנדע עד כמה אנו מאושרים בזה שיש לנו הזכיה לשמש את המלך, כי אין לנו כלום שנוכל להבין את גדלותו. וזה נקרא בלשון הזהר הקדוש, שכינתא בעפרא, היינו שענין להשפיע אליו יתברך הוא חשוב לנו כמו עפר. וממילא אין לנו חמרי דלק לעבודה, כי בלי תענוג אין כח לעבודה. אלא במקום שמאיר אהבה עצמית, אז הגוף מקבל חיות מזה, אבל בעבודה דלהשפיע, אין הגוף מרגיש בזה טעם של תענוג, וממילא הוא מוכרח להיות ""רובץ תחת משאו"". מה שאין כן כשמרגיש שהוא משמש מלך חשוב, לפי חשיבותו של המלך, בשיעור זה יש לו הנאה ותענוג שמשמש אותו. לכן אז כבר יש לו חמרי דלק, שיתנו לו כח כל פעם שיוכל ללכת קדימה, משום שמרגיש שהוא משמש למלך חשוב."
"(הרב""ש. 24. ""עיקר מה שחסר לנו"")"

"6. אם האדם רוצה לעבוד ולקיים תורה ומצות בלי שום שכר, רק מטעם שהוא רוצה לשמש את המלך, אז הוא כבר זקוק לדעת גדלות המלך. כי שיעור עבודתו תלוי בשיעור שהוא מאמין בגדלות המלך, כי רק גדלות וחשיבות המלך נותן לו חומרי דלק לעבודה. וזהו כמו שכתוב בזה""ק על פסוק ""נודע בשערים בעלה"". פירוש, כל אחד ואחד לפום מה דמשער בלביה [לפי מה שמשער בליבו]. משמיענו בזה, שכפי מה שהאדם משער בלביה [בליבו] גדלות וחשיבות ה', בשיעור זה הוא מוסר עצמו לשמש את המלך. "
"(הרב""ש. מאמר 12 ""מהו תורה ומלאכה בדרך ה'"" 1988)"

"7. אם האדם יתן תשומת לב לחשיבות של המלך, יהיה להאדם סיפוק מלא בזה שניתן לו לקיים תורה ומצות, עד כמה שאפשר לו. אפילו נגיד, שיש לו זכיה לדבר עם המלך הגדול, שלא נותנים לכל אחד להכנס לדבר עם המלך. אלא צריכים השתדלות גדולה אצל אלו המקורבים אל המלך, שיתנו לו היכולת לדבר כמה מילים עם המלך. כמה רוממות רוח היתה להאדם הזה, בו בעת שהוא רואה, שיש הרבה אנשים שאצלם לא די שלא נותנים להם להכנס להמלך, אלא לא מספרים להם שהמלך נמצא כאן בעיר, ושיש אנשים, שיש להם היכולת לדבר עם המלך."
"וכשהוא רואה שיש אנשים בעולם שלא יודעים מזה שיש בהעולם מלך, ורק קומץ אנשים קטן מאוד ישנו בעולם, שנתנו להם מחשבה ורצון להאמין שיש מלך בעולם. ואפילו אלו שכבר נתנו להם הידיעה מהמלך, אבל אין הם יודעים שיש יכולת לדבר עם המלך. ולהאדם הזה, נתנו לו ידיעה משמים שהוא יכול להכנס ולדבר עם המלך, היינו שהוא יכול להאמין. "
"(הרב""ש. מאמר 12 ""מהו מחצית השקל בעבודה - א'"" 1987)"

"8. החיים שהאדם רוצה שיהיה לו קשר עם הבורא, בין בבחינת תפלה, שהוא מבקש ממנו, שיתן לו איזה דבר, או שנותן תודה לה', על מה שכבר נתן לו, סוף כל סוף הוא מדבר אז להבורא. מזה הקשר שמדבר להבורא, זה מביא לו חיים, אם הוא מחשיב את השיחה שיש לו עם הבורא, והוא ממשיך חיים, מזה שלא חסר לו אז שום דבר. כלומר, אם ביכולתו של האדם לתת תשומת לב ולצייר בעצמו, שבאם היה יכול לדבר למלך בשר ודם, שכולם מחשיבים אותו, שזה יש בהטבע, שהאדם יכול לתת את כל מה שבידו, בכדי לדבר עם המלך, והאדם הזה, אם הוא יכול להתחזק באמונתו, שהוא מדבר למלך מלכי המלכים, שלא עם כולם הוא מדבר."
"(הרב""ש. מאמר 3 ""מהו ששמו של הקב""ה נקרא אמת"" 1988)"

"9. כבוד המלך הוא, שכולם מכירים בחשיבות המלך, וכולם רוצים לעבוד אותו בכל לבבם ובכל נפשם. וזהו יפה לראות איך שכולם עומדים ומשבחים ומדברים רק בשבח המלך, איך שהוא דואג שיהיה כל טוב לבני המדינה. וזהו פירוש, ""כי אין לבוא בשער המלך בלבוש שק"", שהוא בגד מלוכלך. אלא כשבאים בשער המלך, צריכים להיות מלובשים בבגדים המתאימים לשבת בשער המלך. אחרת, היינו כשהוא יושב בלבוש שק, זהו סימן שהוא לא שבע רצון מהמלך, אלא יושב ומתאבל על מה שחסר לו בחיים, ואין לו מנוחת הנפש. נמצא, שהוא יושב ומתאבל, והוא בזיון המלך, על מה שהמלך לא מרחם עליו, ולא ממלא את מבוקשו."
"(הרב""ש. מאמר 12 ""מהו מחצית השקל בעבודה - א'"" 1987)"

"10. רק עצה אחת יש לנו, שהיא להשתדל איך להשיג גדלות ה'. זאת אומרת, כל מה שאנו עוסקים בתו""מ, אנו רוצים, שהשכר שלנו יהיה להרגיש גדלות הבורא. וכל התפלות, שאנו מתפללים, צריכות להיות ""לאקמא שכינתא מעפרא"" [להקים שכינה מעפר], היות שהבורא נסתר מאתנו מחמת הצמצום שהיה, ואין אנו מסוגלים להעריך את חשיבותו וגדלותו. "
