"לכן אנו מתפללים לה', שיסיר מאתנו את הסתרתו, ושירומם קרן התורה. וכמו שאנו אומרים בתפלת ""שמונה עשרה"" דראש השנה ""ובכן תן כבוד לעמך"", שפירושו, שיתן כבוד ה' לעמך, שהם ירגישו את כבוד המלך. "
"ומשום זה האדם צריך להשתדל ולא לשכוח את המטרה בעת לימוד התורה, שיהיה תמיד לנגד עיניו, שהוא רוצה לקבל מהלימוד, שהלימוד ישפיע גדלות וחשיבות הבורא. "
"(הרב""ש. מאמר 29 ""לשמה ושלא לשמה"" 1986)"

"11. עלינו לדעת, כי זה שניתן לנו ענין אהבת חברים, הוא ללמוד מזה שלא לפגום בכבוד המלך. פירוש, שאם אין לו רצון רק להשפיע נחת רוח להמלך, בטח הוא יפגום בכבוד המלך, שזה נקרא שמוסר קדושה לחיצוניים. ומשום זה לא לזלזל בכבוד של חשיבות של עבודת אהבת חברים, כי ממנה האדם ילמד איך לצאת מאהבת עצמית, ולהכנס לדרך של אהבת הזולת. וכישגמור את העבודה של אהבת חברים, אז הוא יכול לזכות לאהבת ה'. "
"(הרב""ש. מאמר 13 ""בוא אל פרעה - ב'"" 1986)"

"12. ""ברוב עם הדרת מלך"", נמצא, מה שהרבים יותר גדול, הכח של הרבים יותר פועל, היינו שמייצרים אוירה יותר חזקה של גדלות וחשיבות של הקב""ה. שאז כל אחד ואחד, הגוף שלו מרגיש, שכל המעשים מה שהוא רוצה לעשות עבור קדושה, שהוא להשפיע לה', להון תועפות יחשב לו, שזכה להכנס בין האנשים, שזוכים לשמש את המלך. ואז, כל מעשה קטנה שהוא עושה, הוא מלא שמחה ותענוג, שיש לו עתה במה לשמש את המלך. "
"ולפי שיעורו, שהחברה עם מחשבותיהם בעת ההתועדות חשבו בגדלות ה', כל אחד לפי שיעורו גורמו לו חשיבות בגדלות ה', כן הוא יכול ללכת כל היום בעולם השמחה והחדוה. "
"(הרב""ש. מאמר 17 ""סדר ישיבת התוועדות"" 1986)"

"13. כל הרווח שלנו הוא, שנזכה לשמש את הבורא יתברך. וזהו דבר חשוב מאוד, משום שזה הוא ענין של אמת, היינו שיזכה להיות דבוק במלך מלכי המלכים. מה שאין כן כשכל התענוגים בנויים בזה, שכל הנאה שיש לו, הוא בזה שלוקח הנאה ותענוג בזה שמשמש את עצמו, ולקבל תענוג בלבושים של קבלה שייך גם לבעלי חיים ולאו דוקא לבני אדם, שהוא מובחר היצורים, שיהנה מאותם לבושים שבעלי חי נהנין, זה לא מתאים בשבילו. "
"אלא כל הלבושים, שהאדם רוצה לקבל הנאה, יהיה מלבושים של כלים דהשפעה. זאת אומרת, בלי תענוג אי אפשר לעבוד. אלא התענוג שלו הוא, במה שכל התענוגים שלו נמדדים, כמה שהוא יכול להשפיע להמלך. היינו, אם הוא רוצה לדעת, כמה הוא מקבל הנאה מעבודתו, אל ימדוד כמה הוא נהנה מעבודתו, שפירושו, כמה שיש לו הנאה משימוש המלך. אלא ימדוד ממעשים, היינו כמה הוא רוצה שהמלך יהנה מעבודתו. נמצא, שכל חשיבתו הוא ממה שהוא משמש את המלך. "
"(הרב""ש. מאמר 5 ""בענין כבוד אב"" 1986)"

"14. בזמן שהאדם מתעסק בתורה ומצות, אז הזמן להיות בשלימות, כלומר, כאילו שהקב""ה קירב אותו להיות מהמשמשי המלך. אולם אין האדם צריך לשקר לעצמו, לומר שהוא מרגיש, שהוא משמש את המלך, בזמן שאין לו הרגשה כזו. אם כן איך הוא יכול לתת תודה רבה על זה שקירב אותו, אם אין הוא מרגיש זה. "
"אלא האדם צריך אז לומר, שאף על פי שהוא נמצא בתכלית השפלות, כלומר שהוא עדיין משוקע באהבה עצמית, ועדיין אינו מסוגל לעשות משהו למעלה מהדעת, מכל מקום ה' נתן לו מחשבה ורצון לעסוק בתו""מ. וגם נתן לו קצת כח, שיוכל להתגבר על בחינת מרגלים, מה שמדברים אליו, ונוקרים את ראשו בטענותיהם, ומכל מקום הוא יש לו קצת אחיזה ברוחניות. "
"אז האדם צריך לתת תשומת לב על זה, ולהאמין, שה' מטפל עמו, ומדריכו ללכת בהמסלול המוביל להיכל המלך. "
"(הרב""ש. מאמר 6 ""מתי האדם צריך להשתמש עם גאוה, בעבודה"" 1990)"

"15. הזהר הקדוש שואל, הלא כתיב ""קרוב ה' לנשברי לב"". העובד ה', היינו מי שכוונתו בעל מנת להשפיע, צריך להיות בשמחה בזה, שמשמש את המלך. ואם אין לו שמחה בזמן העבודה הזאת, סימן שחסר לו בהערכת גדלות המלך. לכן אם רואה שאין לו שמחה, אז צריך לתקן, היינו שיחשוב בגדלות המלך. ואם מכל מקום הוא לא מרגיש, יש לו להתפלל לה', שה' יפתח עיניו וליבו, שירגיש את גדלות ה'."
וכאן מתפתחות ב' הבחינות:
א. בזה שאין לו הרגשת גדלות המלך צריך להצטער.
"ב. צריך להיות בשמחה בזה שכל הצער מהחסרונות על רוחניות, ולא כמו שאר אנשים, שכל חסרונות, שמהם מצטערים, הם רק על על מנת לקבל."
"וצריך לדעת, מי הוא שנתן לו לאדם את הידיעה הזאת, שצריך להצטער על רוחניות. ומזה הוא צריך להיות שמח, שה' שלח לו מחשבות של חסרון רוחני, שזה בעצמו נקרא ישועת ה'. ולכן הוא צריך לשמוח. "
"(הרב""ש. 42. ""עבדו ה' בשמחה"")"

"16. העיקר הוא התפלה. היינו, שהאדם צריך להתפלל לה', שיעזור לו ללכת למעלה מהדעת. כלומר, שהעבודה צריכה להיות בשמחה, כאילו כבר זכה לדעת דקדושה. ובאיזו שמחה היתה אז עבודתו, כמו כן הוא צריך לבקש מה', שיתן לו את הכח הזה, שיהיה בידו ללכת למעלה מדעתו של הגוף."
"כלומר, אף על פי שהגוף לא מסכים לעבודה זו בעל מנת להשפיע, רק הוא מבקש מה', שיהא בידו לעבוד בשמחה, כמו שמתאים למי שמשמש מלך גדול. ואין הוא מבקש מה', שיראה גדלות ה', ואז הוא יעבוד בשמחה. אלא הוא רוצה, שה' יתן לו שמחה בעבודה דלמעלה מהדעת, שיהיה חשוב אצל האדם, כאילו כבר יש לו דעת. "
"(הרב""ש. מאמר 12 ""הנרות הללו קודש הם"" 1991)"

"17. משל: אדם ההולך באם הדרך, ורואה גן נחמד למראה, ושומע קול קורא מכוון אליו מהמלך אשר מתהלך בתוך הגן. מרוב התפעלות עבר בקפיצה אחת את הגדר והנה הוא בתוך הגן. ומתוך התרגשותו וזריזותו לא הרגיש שהוא הולך לפני המלך, והמלך נמצא בסמוך אליו ומטייל מאחוריו."
"וכך הוא הולך ומודה ומשבח את המלך בכל כוחו בכוונה להכין את עצמו לקבל פני המלך. והוא אינו מרגיש כלל שהמלך מצוי לידו. ולפתע הוא מחזיר פניו ורואה את המלך נמצא לידו. כמובן שלשעתו, גדלה השמחה מאד. והתחיל לטייל אחרי המלך, בהלול ושבח כפי כוחו, כי המלך מלפניו והוא אחרי המלך. "
"וכה הולכים ומטיילים, עד מקום הפתח. ונמצא האדם יוצא מהפתח, ושב אל מקומו כבתחילה, והמלך נשאר בגן ונועל הפתח. וכשמסתכל האדם שכבר נפרד הוא. ואין המלך עמו, הוא מתחיל לבקש פתח הגן לעומת שיצא, באופן שהמלך יהיה מלפניו. אבל אין פתח כזה כלל. אלא לעומת שבא בפעם הראשונה באופן שהוא מקדים את המלך. והמלך היה מאחוריו מבלי שירגיש בזה. כן צריך להיות גם עתה. אבל צריך שיהיה אומן גדול לזה. "
"(בעל הסולם. אגרת מ""ב)"
